{
  "catalogVersion": "1.0",
  "vehicle": "Volkswagen Golf Mk7/Mk7.5",
  "market": "US",
  "firstModelYear": 2015,
  "lastModelYear": 2021,
  "executionPolicy": "catalog-only",
  "compatibilityKeys": [
    "modelYear",
    "engine",
    "transmission",
    "controlUnitAddress",
    "controlUnitPartNumber",
    "controlUnitSoftwareVersion",
    "installedEquipment"
  ],
  "categories": [
    {
      "name": "Access and locking",
      "apps": [
        "Auto Lock while driving",
        "Auto Unlock when parked",
        "Auto Lock/Unlock",
        "Automatic Unlock",
        "Central Lock with ignition",
        "Selective central locking",
        "Lock confirmation chirp",
        "Unlock confirmation chirp",
        "Alarm activation",
        "Anti-theft alarm",
        "Panic button behavior",
        "Keyless-access behavior",
        "Remote window opening",
        "Remote window closing",
        "Comfort windows",
        "Sunroof action via remote",
        "Fuel-flap locking",
        "Door-lock tests"
      ]
    },
    {
      "name": "Lighting",
      "apps": [
        "Scandinavian DRLs",
        "DRL menu in infotainment",
        "DRLs inactive with parking brake",
        "DRLs inactive with turn signal",
        "Fog lights with high beams",
        "Fog lights with flash-to-pass",
        "Fog lights as cornering lights",
        "Coming Home lights",
        "Leaving Home lights",
        "Coming/Leaving Home activation type",
        "Coming Home duration",
        "Leaving Home duration",
        "Automatic Coming Home",
        "Highway lights",
        "Rain lights",
        "Parking-light configuration",
        "Side-marker lights",
        "LED license-plate-light retrofit",
        "License-plate-light brightness",
        "Taillights as DRLs",
        "Taillights as brake lights",
        "Inner taillights as brake lights",
        "Brake-light brightness",
        "Emergency brake flashing",
        "Dynamic turn signals",
        "Urban Joke lighting",
        "Comfort turn-signal count",
        "Turn signals as parking lights",
        "Rear fog-light configuration",
        "High Beam Assist",
        "Light-assist memory",
        "Headlight-washer behavior",
        "Headlight-washer delay",
        "Headlight-washer cycle count",
        "Instrument and switch brightness"
      ]
    },
    {
      "name": "Mirrors, windows, and wipers",
      "apps": [
        "Automatic folding mirrors",
        "Fold mirrors with remote",
        "Mirror unfolding behavior",
        "Passenger mirror dip in reverse",
        "Mirror heating",
        "Mirror-heating duration",
        "Window operation after ignition is switched off",
        "Rain-closing windows",
        "Rain-closing sunroof",
        "Tear-wipe",
        "Rear wiper in reverse",
        "Rear-wiper interval",
        "Wiper service position",
        "Windscreen-washer warning",
        "Washer-fluid indicator"
      ]
    },
    {
      "name": "Dashboard",
      "apps": [
        "Gauge test/needle sweep",
        "Digital speed display",
        "Lap timer",
        "Oil-temperature display",
        "Refuel quantity",
        "Remaining fuel display",
        "Fan-speed display in automatic mode",
        "Gear display",
        "Transmission-temperature display",
        "Battery-charge display",
        "Telephone battery display",
        "Navigation compass",
        "Road-sign display",
        "Speed warning",
        "Seat-belt warning configuration",
        "Ice-warning temperature",
        "Instrument-cluster startup logo",
        "Instrument illumination",
        "Consumption-display correction",
        "Speedometer correction",
        "Service interval display",
        "Driving-school mode",
        "Off-road display"
      ]
    },
    {
      "name": "Driver assistance",
      "apps": [
        "Adaptive Cruise Control distance menu",
        "ACC default distance",
        "ACC driving profile",
        "ACC overtaking assistance",
        "Lane Assist",
        "Lane Assist memory",
        "Lane Assist intervention strength",
        "Lane Assist extended time",
        "Traffic Jam Assist",
        "Extended Lane Assist with Traffic Jam Assist",
        "Front Assist camera configuration",
        "Traffic-sign recognition",
        "Driver-alert system",
        "Hill-hold behavior",
        "Electronic differential-lock strength",
        "Steering assistance",
        "Trailer-assist configuration",
        "Park Assist activation tone",
        "Automatic parking-sensor activation",
        "Optical Parking System",
        "Rear-view-camera configuration"
      ]
    },
    {
      "name": "Interior and comfort",
      "apps": [
        "Air-conditioning airflow adjustment",
        "Air recirculation memory",
        "Heated-seat memory",
        "Seat-heating balance",
        "Footwell-light activation",
        "Footwell-light brightness",
        "Ambient-light configuration",
        "Interior-light behavior",
        "Interior-light fade",
        "Trunk-light behavior",
        "Trunk-opening behavior",
        "Horn behavior",
        "Soundaktor volume",
        "Start/Stop button illumination"
      ]
    },
    {
      "name": "Infotainment",
      "apps": [
        "Video in Motion",
        "Driving-mode display",
        "Performance monitor",
        "Off-road monitor",
        "Infotainment startup logo",
        "Developer/engineering menu",
        "Bluetooth settings",
        "Additional media-source settings",
        "Rear-view-camera display behavior",
        "Parking-sensor visualization",
        "Vehicle-status menu",
        "Driving-data menu"
      ]
    },
    {
      "name": "Powertrain-dependent",
      "apps": [
        "Start/Stop system configuration",
        "Start/Stop voltage threshold",
        "Start/Stop memory",
        "Soundaktor adjustment",
        "Throttle-body alignment",
        "Fuel-system priming",
        "Fuel-pump activation",
        "DSG basic settings",
        "DSG adaptation reset",
        "Exhaust-flap behavior",
        "DPF service functions",
        "Injector adaptation"
      ]
    },
    {
      "name": "Service and workshop",
      "apps": [
        "Oil service reset",
        "Inspection service reset",
        "Service interval configuration",
        "Brake-pad replacement mode",
        "Electronic parking-brake service mode",
        "Brake bleeding",
        "Battery replacement/adaptation",
        "Steering-angle calibration",
        "Parking-brake calibration",
        "Tire-pressure reset",
        "TPMS configuration",
        "Transport mode",
        "Factory mode",
        "Control-unit output tests",
        "Lighting output tests"
      ]
    }
  ]
}
